{
  "$schema": "../schemas/curriculum.schema.json",
  "schema_version": "1.0",
  "version": "2026-07-20",
  "verified_on": "2026-10-15",
  "language": "en",
  "domains": [
    {
      "id": "D1",
      "name": "Cloud concepts",
      "weight_min": 25,
      "weight_max": 30
    },
    {
      "id": "D2",
      "name": "Azure architecture and services",
      "weight_min": 35,
      "weight_max": 40
    },
    {
      "id": "D3",
      "name": "Azure management and governance",
      "weight_min": 30,
      "weight_max": 35
    }
  ],
  "subdomains": [
    {
      "id": "D1.1",
      "domain_id": "D1",
      "name": "Cloud computing",
      "expected_objectives": 7
    },
    {
      "id": "D1.2",
      "domain_id": "D1",
      "name": "Cloud benefits",
      "expected_objectives": 4
    },
    {
      "id": "D1.3",
      "domain_id": "D1",
      "name": "Cloud service models",
      "expected_objectives": 4
    },
    {
      "id": "D2.1",
      "domain_id": "D2",
      "name": "Azure architecture",
      "expected_objectives": 7
    },
    {
      "id": "D2.2",
      "domain_id": "D2",
      "name": "Compute and networking",
      "expected_objectives": 6
    },
    {
      "id": "D2.3",
      "domain_id": "D2",
      "name": "Storage and migration",
      "expected_objectives": 6
    },
    {
      "id": "D2.4",
      "domain_id": "D2",
      "name": "Identity and security",
      "expected_objectives": 8
    },
    {
      "id": "D3.1",
      "domain_id": "D3",
      "name": "Costs",
      "expected_objectives": 4
    },
    {
      "id": "D3.2",
      "domain_id": "D3",
      "name": "Governance",
      "expected_objectives": 3
    },
    {
      "id": "D3.3",
      "domain_id": "D3",
      "name": "Management and deployment",
      "expected_objectives": 5
    },
    {
      "id": "D3.4",
      "domain_id": "D3",
      "name": "Monitoring",
      "expected_objectives": 3
    }
  ],
  "competencies": [
    {
      "id": "AZ900-1.1.1",
      "name": "Cloud foundations",
      "description": "Explain on-demand access to shared compute, network and storage capacity.",
      "domain_id": "D1",
      "subdomain_id": "D1.1",
      "learning_objectives": [
        "Explain on-demand access to shared compute, network and storage capacity.",
        "Explain cloud foundations in your own words and apply the distinction to an unfamiliar scenario."
      ],
      "concepts": [
        "cloud computing",
        "on-demand",
        "resource pooling"
      ],
      "prerequisites": [],
      "sources": [
        "official-guide",
        "learn-cloud"
      ],
      "complementary_resources": [
        "savill-course",
        "ricardo-pt"
      ],
      "misconceptions": [
        "Cloud means only storing files remotely."
      ],
      "evaluation_criteria": [
        "Explain what changes when a local workload moves to an on-demand provider.",
        "Reject the listed misconception with a reason rather than only naming a product."
      ],
      "mastery_criteria": [
        "At least two independently scored, reasoned demonstrations in different scenarios.",
        "Include an uncued explanation and later retrieval; hints or a lucky choice alone are inconclusive."
      ],
      "provenance": {
        "source_id": "official-guide",
        "source_section": "Describe cloud computing",
        "source_bullet": 1,
        "editorial_status": "paraphrased-and-mapped",
        "verified_on": "2026-10-15"
      },
      "exam_version": "2026-07-20"
    },
    {
      "id": "AZ900-1.1.2",
      "name": "Shared responsibility",
      "description": "Allocate provider and customer duties as the service abstraction changes.",
      "domain_id": "D1",
      "subdomain_id": "D1.1",
      "learning_objectives": [
        "Allocate provider and customer duties as the service abstraction changes.",
        "Explain shared responsibility in your own words and apply the distinction to an unfamiliar scenario."
      ],
      "concepts": [
        "shared responsibility",
        "data",
        "operating system"
      ],
      "prerequisites": [
        "AZ900-1.1.1"
      ],
      "sources": [
        "official-guide",
        "learn-cloud"
      ],
      "complementary_resources": [
        "savill-course",
        "ricardo-pt"
      ],
      "misconceptions": [
        "The cloud provider secures all customer data and configuration."
      ],
      "evaluation_criteria": [
        "Assign data, operating-system and datacenter responsibilities for IaaS, PaaS and SaaS.",
        "Reject the listed misconception with a reason rather than only naming a product."
      ],
      "mastery_criteria": [
        "At least two independently scored, reasoned demonstrations in different scenarios.",
        "Include an uncued explanation and later retrieval; hints or a lucky choice alone are inconclusive."
      ],
      "provenance": {
        "source_id": "official-guide",
        "source_section": "Describe cloud computing",
        "source_bullet": 2,
        "editorial_status": "paraphrased-and-mapped",
        "verified_on": "2026-10-15"
      },
      "exam_version": "2026-07-20"
    },
    {
      "id": "AZ900-1.1.3",
      "name": "Deployment models",
      "description": "Distinguish publicly offered cloud capacity, a private cloud and a connected hybrid environment.",
      "domain_id": "D1",
      "subdomain_id": "D1.1",
      "learning_objectives": [
        "Distinguish publicly offered cloud capacity, a private cloud and a connected hybrid environment.",
        "Explain deployment models in your own words and apply the distinction to an unfamiliar scenario."
      ],
      "concepts": [
        "public cloud",
        "private cloud",
        "hybrid cloud"
      ],
      "prerequisites": [
        "AZ900-1.1.1"
      ],
      "sources": [
        "official-guide",
        "learn-cloud"
      ],
      "complementary_resources": [
        "savill-course",
        "ricardo-pt"
      ],
      "misconceptions": [
        "A public cloud makes every customer workload publicly accessible."
      ],
      "evaluation_criteria": [
        "Compare ownership, access and integration across the three deployment models.",
        "Reject the listed misconception with a reason rather than only naming a product."
      ],
      "mastery_criteria": [
        "At least two independently scored, reasoned demonstrations in different scenarios.",
        "Include an uncued explanation and later retrieval; hints or a lucky choice alone are inconclusive."
      ],
      "provenance": {
        "source_id": "official-guide",
        "source_section": "Describe cloud computing",
        "source_bullet": 3,
        "editorial_status": "paraphrased-and-mapped",
        "verified_on": "2026-10-15"
      },
      "exam_version": "2026-07-20"
    },
    {
      "id": "AZ900-1.1.4",
      "name": "Deployment model selection",
      "description": "Choose public, private or hybrid deployment from business and technical constraints.",
      "domain_id": "D1",
      "subdomain_id": "D1.1",
      "learning_objectives": [
        "Choose public, private or hybrid deployment from business and technical constraints.",
        "Explain deployment model selection in your own words and apply the distinction to an unfamiliar scenario."
      ],
      "concepts": [
        "public cloud",
        "private cloud",
        "hybrid cloud"
      ],
      "prerequisites": [
        "AZ900-1.1.3"
      ],
      "sources": [
        "official-guide",
        "learn-cloud"
      ],
      "complementary_resources": [
        "savill-course",
        "ricardo-pt"
      ],
      "misconceptions": [
        "Hybrid means using two public providers."
      ],
      "evaluation_criteria": [
        "Justify a model for a legacy workload with on-premises dependencies.",
        "Reject the listed misconception with a reason rather than only naming a product."
      ],
      "mastery_criteria": [
        "At least two independently scored, reasoned demonstrations in different scenarios.",
        "Include an uncued explanation and later retrieval; hints or a lucky choice alone are inconclusive."
      ],
      "provenance": {
        "source_id": "official-guide",
        "source_section": "Describe cloud computing",
        "source_bullet": 4,
        "editorial_status": "paraphrased-and-mapped",
        "verified_on": "2026-10-15"
      },
      "exam_version": "2026-07-20"
    },
    {
      "id": "AZ900-1.1.5",
      "name": "Consumption economics",
      "description": "Relate metered resource use to operating expenditure and variable demand.",
      "domain_id": "D1",
      "subdomain_id": "D1.1",
      "learning_objectives": [
        "Relate metered resource use to operating expenditure and variable demand.",
        "Explain consumption economics in your own words and apply the distinction to an unfamiliar scenario."
      ],
      "concepts": [
        "consumption",
        "OpEx",
        "CapEx"
      ],
      "prerequisites": [
        "AZ900-1.1.1"
      ],
      "sources": [
        "official-guide",
        "learn-cloud"
      ],
      "complementary_resources": [
        "savill-course",
        "ricardo-pt"
      ],
      "misconceptions": [
        "A stopped workload can never incur any cloud charges."
      ],
      "evaluation_criteria": [
        "Explain why unused attached capacity can still incur costs.",
        "Reject the listed misconception with a reason rather than only naming a product."
      ],
      "mastery_criteria": [
        "At least two independently scored, reasoned demonstrations in different scenarios.",
        "Include an uncued explanation and later retrieval; hints or a lucky choice alone are inconclusive."
      ],
      "provenance": {
        "source_id": "official-guide",
        "source_section": "Describe cloud computing",
        "source_bullet": 5,
        "editorial_status": "paraphrased-and-mapped",